id,review
3ba8b30df46c10e66e4fdb3a24ac72ef,"Merci beaucoup pour avoir fait ce coure. C'et l'un de meilleur MOOC que j'ai uivi et j'en ai fait pa mal. Il me emble qu'il y a un grand travail derrière ce cour. Le profeeur, le ujet et le explication me emblent excellent. Merci beaucoup, j'epère que vou en ferez beaucoup plu avec cette grande qualité."
2eb82397716ac4d93cb5fa603de07d33,"Am already impreed with the introductory animation and note, it' an aweome coure worth a take"
9eebd9eedf75da564539d54edb382337,The course is very good. It covered basic knowladge of the forensic science. I want to thank to Nanyang Technological university and coursera.
2b6308f29c764bc4fd7e741218600c3d,It is a great course to get knowledge of some important and very basic mathematics used in machine learning. It is a well-taught course. The instructors are very good.
d9c6bc469aac37b83426567eede6016d,"clear knowledge structure, easily understandable language, necessary evidence to support viewpoint, and supplementary of working tools and interactive tests.perfect course"
e3794db4193fffa519a22cbc3d094ad2,"Quite intereting I mut admit, eye-opener of a coure it wa, giving inight to the many facet of ecurity a it effect the day to day concern of ordinary citizen.I can't wait for the advanced coure!"
106f5065527094b2fe97e7a2ac074aff,"Really amazing course,   is one of the most successful professors in the world, not only he briantly teaches ML/AI, but he also does it with great sense of humility. Thank you Sir!!!"
6310bfd9213d1496958bca32dfd1b877,This is one of the outstanding courses on Political Philosophy and Practice and the best starter for the beginner in the field.
ef2fef78341ca203d211c7ba4da6df7c,"E un buen curo, te llevan de la mano y te dan uficiente bibliografía, para que te irva de apoyo para etudiar y paarlo.It a great coure, they teach you hand to hand and they give you many litterature a upport in order that you can tudy and ucce the coure."
0d1dde005f038b1565b2bb898c4a6e42,"This was excellent!  As a professional dog trainer, I really value the information I got from this course.  Yes I also bought his book but It is a really good resource.  You can get it used at a lower cost.  I have been recommending this course to my ""want to know more"" clients."
4cd59dcc21e3e854709e2ce39d901f73,"Very intereting and ueful coure for
every buine profeional."
6a549304cfeade128e71008449b864a4,"Amazing!! As a beginner in Forensic science, I gathered so much knowledge. The professor is SPECTACULAR!!!!!!"
f003fe5a02d8d81d575c4fa9f459a0e9,"Thanks Professor ! You are the best teacher I've ever met. The course is always easy to comprehend and succinct and I can feel your joy for studying mathematics. It made me feel joy too, in studying mathematics. I really look forward to your new course in advanced calculus. Thanks a lot."
20ba3659535c1ccc89b1b709f0bc891a,"Very good introduction to Philoophy, it make you continue to invetigate and ak yourelf about your belief and try to place yourelf in any of the theorie or perpective of the philoopher, a well a realize that you were not o wrong. Thank you."
007aed7f2ac0100950060760ba8c7438,"This is one of the
best courses I have taken on coursera. This course will really help
one to understand the nuances of clinical research by enabling a
strong understanding of statistical concepts commonly used in this
research. Dr.  is a great teacher and he takes you through
different concepts in the clinical research by bringing on examples
from published research articles and also highlights how these
concepts were applied to conclude the results stated in the article. 
Thanks alot Dr. 
for this course"
6398d03e2d93999d5a9398acaafa0877,"I was glad to have had the opportunity to take this course.  History texts,books need to be corrected and this course would be very useful for Grade 7, 8 and above.  With regards to a specific ongoing battle out in the East Coast between the Miqmaq and the commercial fishermen - I am thinking that anyone who applies for a commercial liscence re fishing, hunting, logging, and any kind of resource extraction should HAVE to take a similiar kind of course as part of the liscensing process BEFORE they get their liscence. Hopefully something like this might deter events escalating to the point that they have out East. Gchii-miigwetch to all the intsructors, elders, artists and others who contributed to this course. I quickly caught the word indoctrination in one review and yeah if you have to see it that way -  it might seem to be the only way to correct and move forward from the harm done by colonization."
04e520493fa8523bc2b1f448b7646035,"A coure that ha a decent amount of work and a lot of content to cover in a hort amount of lecture and reading. There are optional dicuion prompt, but if a tudent i well-engaged into the coure they would be partaking in thoe too. The coure intend not jut for you to learn about IHL, but alo to analye, evaluate and debate different IHL concept with other tudent."
494a9d72eb0b64ef5f53dcafa00c5605,"Great! I love the course, Prof. ! I really appreciate your way of explaining and visually showing everything! Great to see all written or drawn as well! :)"
7565717bcdab57a0bdf55d39fb38e2bf,"The content of thi
coure i wide-ranging, clear and well-tructured; hence I would definitely
recommend it to my colleague. I would rate the
performance of all profeor a excellent; they have definitely made me quite
eay, a firt approach to Game Theory.Thank to the Stanford
and congratulation on thi coure"
2385d3b47f928f587060934541aa6718,It's a pretty nice course wherein one gets to learn a lot. I was only disappointed at one point during week 6 when I was expected to participate in a real negotiation but wasn't able to find a partner on the forum. But in general it's a good course.
d06ea3f0fa966e11f3bdc657c6ef6213,"This course was extremely helpful in understanding what is PFA and how we can use RAPID model to help people after a disaster. I liked Dr  Everly. His voice is so comforting. He teaches passionately. Simulations were the best part to understand what not to say. Thanks Prof  Everly for designing the course, I will look forward to learn advanced level of this course."
4a1bc372d6945e337e8a28ba27862631,Thi coure added a new light into my career. It wa enriching and full of practical and theoretical knowledge. The faculty wa alo very well read and wa able to explain everything by implifying it for the tudent. Thanking the team for uch an enriching and knowledgeable coure.
1ae577b64e1269be42d889801bc2521c,"Shame editing was poorly done. Whoever did it thought that it must be waste of viewers time to wait until  takes breath for next sentence. Not only that we had no time for recollection thoughts, it also makes his head constantly jerking. Very unnatural and unpleasant experience. Other than that course is highly recommended.  is 5 star guy."
650bd376b27e681460503c3e145ec489,Amazing course! Very satisfied!
7b6e7ba83018dba01b2870301684c9e6,I think the videos and assignments were easily understood and yet had some items that made you think and use your learning as it progressed. I'm glad I signed up to refresh myself on the medical language. Thank you.
d078ffe30bd92acdb00217a8af0e81f2,"A very helpful course, understanding the definition of terrorism, but also understand what are differences between terrorism and counterterrorism and what it takes to prevent them."
82cba3b4a9bc49c49212d7c1bf5734fc,"Before join this course, i already know a little about korean from korean drama and korean music. But after i join this course and learn, i know about how pronounce and utilize korean language in a good way. Professor  is a great instructor (Thank you Professor  :) ), she explained and guided me very well. This course is easy to follow and very informative because the course is explained korean language that we used in daily life."
c5263aecb7b15feb4adfdbde9ac4e006,"this course is challenging, but it is 100% do-able if you are committed and really assign a purpose to doing well in this course. dr white is amazing and really knowledgable, there is so much to learn from him. there are also ton of resources for you to do well. you can do it!!"
02a9e51adcd172205bf0da9298d77cf3,Awesome! I am really happy with all the new knowledge I receive!
1b56fbdb1c18bec5b367f8fbe2e1a1ae,"My name i Marly Balderrama, I am a Licenciatura tudent of Letra-Portugue here in São Paulo. Thi wa my firt contact with PHILOSOPHY, I am delighted with the Coure. I thought it wa difficult for me, and it wa. I had to read and warm my brain to undertand, undertand many teaching that our mind i not aware of the detail of life. Only by tudying Philoophy that, with thi dicipline and through it definition, defined and indefinite, concrete or abtract, allowed me to enter thi concept of really tudying everything in thi life. You know what, I loved it."
c87e3606b7cf2e4d65c87ae136d99775,"For the most part it was great. Plenty of learning options available from plain reading of the presentations slides to the actual videos. The questions on the quiz might need some work since the language at times is ambiguous and imprecise. However, overall I am very pleased with the course for F&B and Marketing information in general. Thank you"
e12a68d2e7dc8ee4548c8cbf0e4279de,"I truly appreciated learning about Aboriginal history and culture. I have spoken with many Aboriginal people, including Inuit, and have wondered why there is such a difference between folks from different areas. Now I know some of the answer.I especially appreciate the Aboriginal concept of everything on earth working together for the good of everything. I also appreciate how sexuality was handled--inclusion and pride vs. exclusion and shame, the way I have seen many people handled. What a disgrace to European ideals.There are a few editing errors which do not take away from the content. I'm glad I finally had the time to finish the course. I can't get some of the points out of my mind!Thanks so much for letting me take this course."
2af6d683b13a6f89107378f9404b435e,"The course is enlightening, vast and with lots of real life examples that aided the understanding of the course. Professor   also did a very good job on the topics."
b4d41ba7a0e585accb4684ff0001c37b,"Excellent introduction to Behavioural Finance! As an investor, I have made so many of these behavioural mistakes and it's great to at least be aware of them."
46143a3ccd06921c517ed904448123c6,Very insightful and educating. Good to know about how big organizations from ages sustained from various pandemics and wars and improved depending on the latest generation ideology. Like to take few more courses like this. Thank you Coursera.
f37c4c596aac1a41732f268115575c08,Course very rich of knowledge of sustainable development which can help me understand world situation well than last time.
319a4280c33a45e3434309dee3d21b82,"This course was very informative and useful, through allowing students to learn by practicing their reading, writing, listening, and speaking skills! I really enjoyed how each lesson introduced new vocabulary and cultural insights as well! This course is very well-rounded, and I believe that is what ultimately makes it engaging and something students look forward to keep studying!"
fa339da71f0b85747c63517686d74aee,"Muy buen curso, y hablo en lo personal que soy mexicano, habitamos en un país con altos índices de obesidad y sobrepeso, todas las personas que puedan tener acceso a este tipo de cursos deberian aprovecharlo al máximo y expandir esos conocimientos con sus familiares y amigos"
913d88af32f08d6bd54303d588c2e268,Absolutely amazing course! I recommend it to anyone who is interested in basic Anatomy and wants to learn more! Totally great for beginners. Dr. Scanga is a great professor - I highly recommend!
334f0f4bdce721ca983aa27d346f6eae,It' been concie and entertaining all throughout. It' a great recommend to thoe who want to look behind the cene of deciion making within game.
7393e8db7a626f08d5b9e6cab5d3cb9f,"This was such interesting and eye opening class to take. This class isn't just some do this and do that and you'll be happy, this class proves that if you actually but into practice what is being taught your happiness can and will improve. I highly suggest this course, whether it is for personal or professional growth."
707e7401e686032c1c495e2d7322d889,"While the material is at an introductory level, it is comprehensive.  The exercises are well-structured and the lectures clear."
662d15d8d2c49494c3bae700e18803be,"Me encantó que el curso sea tan simple para gente que no tiene noción de chino, aunque en las últimas ""lectures"" no escribian todo lo que aparece en la pantalla, así que tenía que ver la transcripción para entender o saber algunas cosas que entiendo."
f9879686686c1e73a666b03a6bf5f6ac,It was amazing learning about sports marketing from coursera. It was very informative.
62e4ff2aa8c571a5054b40146ea72acd,"I have learned a lot from this class. The schedule is reasonable and progressive. Firstly, it taught me how to write a resume and a cover letter. Secondly, it helped me practice making a networking elevator speech. Finally, it showed me how to ask and answer questions in a job interview. Thanks all the teachers for their hard work and I hope this course will benefit more students."
41c8ca11fd9629bfc340c2f391780e12,This course is interesting and has great importance as it offers a well structured understanding of mechanisms of mental distress and techniques that lead to recovery. The lectures are read by different specialists from all fields. This is excellent. It promotes the idea that a recovery and positive outcome is possible and provides examples advocating this idea. The positive approach is extremely important.
2fee1a6a7691dd2b3f9a853468731572,Excellent information and coure format. Thank for giving me the opportunity to take it!
fe9f3aea23a8748de4e2f82301814955,"Great course. I had already learned the korean alfabet and this course was a very good introduction to the language itself. The basics you need to start speaking the Korean language.The teacher is good and the pace is nice. I am just sad there is no ""Learn to Speak Korean 2"", but I hope they will do it in the future.I trully recommend this course for anyone who wants to learn Korean and doesn't know anything about it, except the alfabet itself. It is really important to know the alfabet before starting this couse. Fortunately, that was my case..."
ae5be6cf77227f7321709fceef66cca8,"I want to sincerely thank Coursera for this wonderful experience with this course. I have really learnt alot when it come to Brand and marketing as far as Food and Beverage Service is concerned. Now i will use all the tricks, clues and know-how from this course not only to the food and beverage service only but in all my life endeavors. once again, THANK YOU VERY MUCH!!!"
e00ab0fb7900d541c8fd8a76ed4fd816,"Thank you, Dr   for a wonderful experience and the  warmth of your teaching. I did learn things and am hooked on learning more.  The course is well structured and doing the final assignment and reviewing peer assignments, was a great way to consolidate the learning. I hope you do ""mount"" another course or two in the future. I for one will be eager to enrol."
6401ec2aeeebffa42c3f5749345df2d5,"Audio is weak. Bendich is probably a good researcher, but not a good teacher. Doesn't make any effort to speak clearly, tone of voice is that the subject matter is beneath his genius, he's only ""teaching"" the course because Duke ordered him to teach it. Disappointed. I just copied down the curriculum then watched it on Khan. Sal Khan speaks clearly and covers the same boring 10 minute lecture in a lively half the time. Thanks anyway Coursera"
d3e9182042bcf09a176abc88b9461374,Thi coure wa really amazing full of knowledge and kill which I wa looking for regarding my mater' tudie. thank you once again to the dtu and it taff for offering thi pretigiou coure.
2c6acf6e6a56a725bb5868e69658ef41,One of the best online course i have ever taken. Thanks to  sir for explaining all the concepts so engagingly and in detail. Looking forward for course's like this on coursera.
8680da1c354b770d3b9ed4b7194c6cea,"it's a great opportunity to understand systematic review steps and details in meta-analysis. I'm pretty sure, this course affect positively my future career."
d07dcbb21188bf3be746edbab7aace6e,great coure
f7aacaddc7aafe0b07bf49c16418a1bf,"Great ource of knowledge, very profeional.I will high recommended"
556ccebebaaf27d6b3a8c91d27b43054,It is a very good platform for the learners to obtain well equipped education in a well organized manner.Thank you I have learnt the required course.
8c32f3893e07597b9f0d892103678857,"A wonderful pit of ideas and methods, something for everyone. The 
presentation of the learning material is in a very pleasant way. A great
 thank you for this course!"
b53bda6cd1fe564fd61a225c157f75eb,"Um do melhore curo que já tive online. Boa explicaçõe, bom exemplo, bon profeore e bon tema. A ugerir e partilhar. Muito benéfico para quem quer entrar no mundo da inovação e da criação."
24436a38186a305a6bc27525aa4a6963,Professor  was so explicite and clear. She' s so professional. I would like to take more course with her
0f5183556cdfb893a180240aefbeae37,"First, I want to say thank you for Coursera for the gold chance! You are doing a great job in the world how they make learning in our hands from worldwide!

For Mr.   Thank you so much for your teaching us you make a big difference in me. Now I can practice  negotiation, really thank you I'll always remember who teaching me this course. I'm so grateful.. God bless you"
694b6aa9eb332887d88e03dd2ff8adbb,Lo he difrutado mucho. He aprendido mucha coa nueva obre el bienetar animal en relación con lo humano y como deben er tratado egún u neceidade y no como lo antropomorfizamo.
43b6783e9fb1bf18f26ca914d17f3c5d,"It' a perfect coure to improve your French kill. The profeor are amazing, and the explanation i pretty accurate for everything. Furthermore, all the reource are pretty helpful and you never get bored, thi i pretty ueful in an online coure. Félicitation!!!"
c203f068826744e100c67f02a6fac23d,"This course provide a great source of knowledge, Professor   is really good in spreading knowledge. Highly Recommand"
fca2107b061b81f1733063913029bba8,"I loved this course!  Prof  Joordan's was EXCELLENT!!  As an ex-pat Canadian, I loved the Cdn accent and references!  In all seriousness, this course has been a wonderful introduction to psychology with a rich exposure to many concepts within the discipline.  I took the course as a tester to see if pursuing a career in psychology might be on the cards for me.  After taking the course, I feel confident that the Psychology pathway will be the right next step in my career progression."
975ffc01674dcc66587cf185bb1ff08b,This course was very fruitful for my development. I thank the professor for this wonderful session of lectures.
f9ff84738d0e755ce00d386047b236fb,A very inightful coure  into the field of International humanitarian law and practice. The application of the law and Geneva convention  of 1949 and   additional protocol 1 and 2 both play a vital role  herein.
dc92906c7367d023fa8c327f8c5289b3,Very helpful to learn humanitarian law and to chooe a profeional career
ad2df4b0118616d7fc761934e5133f30,"This was a good course for reviewing forensic medicine. Some detail part of medicolegal aspects are insufficient but as a package, it is most essential for the expert to upgrade their knowledge."
f2dd3e45b27e0ef1796c97c9b4d0475a,This was AWESOME!!! Great instructors and great videos. Lots of practice to help develop skills.
8946bebdd36f98d34e5599708b36dd08,comperhensive course in Process mining
11746e73b2ef7e0b361e016097de253f,"Thi i the only french language coure on courera and it the bet, compared with my experience elewhere. It wa tough for me, but I can ee that my reilience paid off and my command of the french language ha improved greatly. I feel more confident with the language. Thank you for putting thi together and I cannot wait for your next french language coure."
75fc777cdd8a13b9d33d21166ad6fa3d,"Being a medical student, knowing that I'll have to deal with all sorts of patients in the future, made me realize that I'll need more than medical skills in order to succeed in my domain and provide the best healthcare experience t my patients. I was lucky enough to find this course by Professor  . Personally, I think this is the most complete course to introduce you to psychology. Pr.  gave an overall view on psychology that will help you, by the end of the course, to talk about so many subjects you weren't aware of before. Huge thanks to Pr., Yale university and Coursera for providing this amazing experience and journey."
25a862b29b525e3c3b7b8ad676945c40,"I like this, but maybe you can use partial scoring for ""select all that apply"" question, maybe with a very low score is also applicable"
d40996130cdda5015ba573326abf54c4,"Excelente curso, muy recomendable. Las explicaciones del profesor muy claras. Los cuestionarios muy útiles para revisar si no se entendió algún concepto. Me llevo un gran aprendizaje."
6557bc8357cd9b0556510ec65bd6c5b8,"Me encanto, me sirvio mucho para recordar nuevamente procesos fisiologicos y para poder aplicarlos en mi diario trabajo docente. Continuare sacando cursos, ahora voy con el de anatomia."
2c34490573b1adb000f2063eb74b9cbc,"I love the profeor! Crim Law i my abolute favorite week (I love the Aritotle reference, myelf being a philoophy major going to law chool). Civil procedure i a bit hard to follow for me."
5f96f38a89581f4a7e7dea262ba5d758,"Most of the description was about the back story of the topic and the ending was abrupt without a proper wrap-up. This was a little off-putting since the Rating of the course was quite high. The professor is good and his speech is quite clear and composed which is the reason for the 3 star rating.However, these mixed feelings have thrown me into a dilemma whether to purchase a certificate or not."
b4ea9a526d962f0402923c2273c9be8c,"Aweome, detailed and crip with relevant theory and formulae."
703a4638e99563a454514ac454b7c23c,thank you coursera
decd8b408e6d6b0c8f3f6a277eda3f68,"The corse is really good. If you had mathematics some time ago and wish to get started again, this course is for you. The last two modules are much better than the first two ones, but I guess it's still a work in progress. Feedback and answers make a huge difference. I learned quite a lot reviewing my own mistakes with the help of the answers.."
634cb798a485647f0f460ebd944e3736,"Thi i to appreciate the coure developer, It really boot my knowledge in all apect of dicipline thi coure i more than children' human right and it ha broaden my knowledge on working with children and repect the right of children to I can vividly ay and champion of children' human right.Thank you"
819ca9c68412aefa78b80778e76aa25e,"Very ""academic"". Lack of real examples and updated materials (one link was even broken)."
d24ca169151705659afaafc9a584ab3c,I really enjoyed and learned a lot from this course. The lecturer was very clear and funny at some point. The principles from this course really work! Thanks so much! I'd definitely recommend this course to my sister and friends.
9742bb8360f1856c6dcd6abf11432079,"I loved the course, I was able to learn a lot, now I can see brands differently and I  am a new type of consumer now. Thanks!"
ba701db513e2ea1c7867ab14720a89a4,"The coure wa organied very well, and touched on all the relevant topic for an apiring veterinary urgeon like myelf - including area I didn't anticipate uch a clinical kill and EQ."
d2bca15e29d0a9bccc2cc53b161aba4b,"A fantastic course!!! An incredibly substantial one, containing a multitude of useful links and recommendations. The latter are flexible, individual-oriented and depend on how  familiar you are with certain aspects of online teaching and certain technical issues. I have been interested in online teaching for a while and have watched a number of webinars, but I had never seen anything of the kind! That's fabulous. really. Expressing my profound gratitude to the creators of the course who have contributed so much to switching my online teaching to the brand new level."
5b3697ac33dfb8a1fbccb6f946219b7c,Great content.Great elucidation.I learnt a lot from this. Thank you Coursera. Thank you Stanford University
4c8fe6a3eab5360008dcce8b4a78dba0,"What a wonderful and insightful course. It was very informative, educational and dynamic. The instructor did a great job explaining all the concepts and keeping all the guest speakers engaged. I highly recommend this course to anyone interested in growing both professionally and personally!"
43255884618beccb7d608a3503065a94,"The course is not that challenging, it could be better, with more challenging tests and assignements."
b385795a5609290649996a14876a3373,"Excelente ete curo. Ele tem uma perpectiva abrangente, que nó faz refletir toda a dimenõe da Economia circular. Aprendi muito!"
c6dde50aa3f1bf016039b5c0e5bd1ca5,"I have an affection for space material and this astronomy course makes me fall in love with the realms beyond, all the more. The thought of many quizzes and essays did scare me initially, but it helps the student/learner to recap on the information presented. Professor   is great at teaching/sharing and I would readily watch these again. Unfortunately the live Q&A (?) sessions are not suitable for my timing so I've not attended those before. I hope that more people will discover the wonder of the universe with this course and a greater appreciation for the stars."
